{"schema_version":"1.0","purpose":"Keep third-party political/media-bias context separate from Atlas provenance and evidentiary role. Neither changes evidence grade automatically.","political_bias":{"supported_providers":["GROUND NEWS","ALLSIDES","AD FONTES"],"provider_rule":"Render a provider only when a publisher rating and that provider's profile URL are stored. Never average providers.","unrated_display":"NO INDEPENDENT POLITICAL-BIAS RATING LOCATED","not_applicable_display":"POLITICAL-BIAS RATING NOT APPLICABLE"},"provenance_categories":["WIRE SERVICE","INDEPENDENT NEWS","STATE MEDIA","OFFICIAL GOVERNMENT","MILITARY / OFFICIAL","REGIONAL NEWS","THINK TANK / RESEARCH","ACADEMIC","OSINT / TECHNICAL","SATELLITE / IMAGERY","ADVOCACY / NGO","SOCIAL / ACTOR CLAIM"],"outlet_overrides":{"Reuters":{"provenance":["WIRE SERVICE"],"atlas_role":"INDEPENDENT FACTUAL SPINE"},"Associated Press":{"provenance":["WIRE SERVICE"],"atlas_role":"INDEPENDENT FACTUAL SPINE"},"Press TV":{"provenance":["STATE MEDIA","IRAN"],"atlas_role":"ACTOR / STATE-MEDIA CLAIM PROVENANCE"},"IRNA":{"provenance":["STATE MEDIA","IRAN"],"atlas_role":"OFFICIAL / STATE CLAIM PROVENANCE"},"U.S. Central Command":{"provenance":["MILITARY / OFFICIAL","UNITED STATES"],"atlas_role":"OFFICIAL U.S. OPERATION / CLAIM PROVENANCE"},"CENTCOM":{"provenance":["MILITARY / OFFICIAL","UNITED STATES"],"atlas_role":"OFFICIAL U.S. OPERATION / CLAIM PROVENANCE"},"Center for Strategic and International Studies (CSIS)":{"provenance":["THINK TANK / RESEARCH"],"atlas_role":"ANALYTICAL / TECHNICAL CONTEXT"},"CSIS Missile Threat":{"provenance":["THINK TANK / RESEARCH","OSINT / TECHNICAL"],"atlas_role":"MISSILE TECHNICAL CONTEXT"},"AWS Registry / NASA OPERA":{"provenance":["SATELLITE / IMAGERY","OSINT / TECHNICAL"],"atlas_role":"PHYSICAL-STATE EVIDENCE"},"AWS Registry of Open Data / Capella Space":{"provenance":["SATELLITE / IMAGERY","OSINT / TECHNICAL"],"atlas_role":"PHYSICAL-STATE EVIDENCE"},"AWS Registry of Open Data / ICEYE":{"provenance":["SATELLITE / IMAGERY","OSINT / TECHNICAL"],"atlas_role":"PHYSICAL-STATE EVIDENCE"},"AWS Registry of Open Data / Umbra":{"provenance":["SATELLITE / IMAGERY","OSINT / TECHNICAL"],"atlas_role":"PHYSICAL-STATE EVIDENCE"}}}